{
  "vector_id": "A",
  "vector_name": "Synthetic Identity & Document Fraud",
  "total_cycles_completed": 3,
  "base_seed": 42,
  "batch_size": 50,
  "orchestration_started_at": "2026-08-17T12:43:15.485318+00:00",
  "orchestration_completed_at": "2026-08-17T12:43:15.533365+00:00",
  "summary_trend": {
    "initial_evasion_rate": 0.0,
    "final_evasion_rate": 0.6286,
    "evasion_delta": 0.6286,
    "initial_detection_rate": 1.0,
    "final_detection_rate": 0.3714,
    "is_adversarial_gain_verified": true
  },
  "cycles": [
    {
      "cycle_index": 0,
      "cycle_id": "cycle_a_0",
      "generation_seed": 42,
      "mutation_tier": "TIER_1_BASELINE",
      "batch_size": 50,
      "total_malicious": 35,
      "total_legitimate": 15,
      "evading_count": 0,
      "caught_count": 35,
      "false_positive_count": 0,
      "evasion_rate": 0.0,
      "detection_rate": 1.0,
      "precision": 1.0,
      "false_positive_rate": 0.0,
      "mean_fraud_score": 0.9893,
      "mutations_applied": [],
      "evading_sample_ids": [],
      "cycle_summary": "Baseline naive Frankenstein profiles caught primarily by Tier 1 barcode & SSA checksum rules.",
      "executed_at": "2026-08-17T12:43:15.490587+00:00"
    },
    {
      "cycle_index": 1,
      "cycle_id": "cycle_a_1",
      "generation_seed": 1042,
      "mutation_tier": "TIER_2_STRUCTURAL_ALIGNMENT",
      "batch_size": 50,
      "total_malicious": 35,
      "total_legitimate": 15,
      "evading_count": 10,
      "caught_count": 25,
      "false_positive_count": 0,
      "evasion_rate": 0.2857,
      "detection_rate": 0.7143,
      "precision": 1.0,
      "false_positive_rate": 0.0,
      "mean_fraud_score": 0.6103,
      "mutations_applied": [
        {
          "parameter": "barcode_pdf417_payload_match",
          "previous_value": false,
          "mutated_value": true,
          "rationale": "Synthesize valid PDF417 payload matching front-of-card OCR fields to bypass Tier 1 barcode check."
        },
        {
          "parameter": "anchor_issuing_state_match",
          "previous_value": false,
          "mutated_value": true,
          "rationale": "Force residential ZIP code and phone area code to match anchor SSN issuing state."
        }
      ],
      "evading_sample_ids": [
        "ID-C655E04A",
        "ID-F76C9013",
        "ID-CA44DFC7",
        "ID-4BB7F716",
        "ID-AFBE619E",
        "ID-7A08A84E",
        "ID-78F70E8E",
        "ID-7B68EE79",
        "ID-9A51163B",
        "ID-507BB15D"
      ],
      "cycle_summary": "Structural parity mutations (PDF417 repair, regional anchor alignment) bypassed Tier 1, raising evasion.",
      "executed_at": "2026-08-17T12:43:15.514842+00:00"
    },
    {
      "cycle_index": 2,
      "cycle_id": "cycle_a_2",
      "generation_seed": 2042,
      "mutation_tier": "TIER_3_FORENSIC_CAMOUFLAGE",
      "batch_size": 50,
      "total_malicious": 35,
      "total_legitimate": 15,
      "evading_count": 22,
      "caught_count": 13,
      "false_positive_count": 0,
      "evasion_rate": 0.6286,
      "detection_rate": 0.3714,
      "precision": 1.0,
      "false_positive_rate": 0.0,
      "mean_fraud_score": 0.2723,
      "mutations_applied": [
        {
          "parameter": "exif_software_header",
          "previous_value": "Adobe Photoshop 2024",
          "mutated_value": "Apple iPhone 15 Pro iOS 17.4",
          "rationale": "Imitate native camera hardware EXIF tags and eliminate editing tool signatures."
        },
        {
          "parameter": "anchor_entity_type",
          "previous_value": "CHILD_MINOR_SSN / DECEASED",
          "mutated_value": "ACTIVE_ADULT (aligned bureau vintage)",
          "rationale": "Eliminate child/deceased SSN demographic inversion flags."
        },
        {
          "parameter": "phone_line_type",
          "previous_value": "VOIP",
          "mutated_value": "TIER_1_POSTPAID_WIRELESS (Verizon/AT&T)",
          "rationale": "Migrate phone carrier from VOIP/Twilio to major mobile network operator with 800+ days tenure."
        }
      ],
      "evading_sample_ids": [
        "ID-97776314",
        "ID-04CDFE32",
        "ID-9EEA83B9",
        "ID-D33BDDBC",
        "ID-96CCE3EA",
        "ID-2EA3690C",
        "ID-58C09CBC",
        "ID-F58ABB19",
        "ID-673B8C47",
        "ID-8157F45A"
      ],
      "cycle_summary": "Deep forensic camouflage (iPhone EXIF, seasoned adult anchors, aged MNO endpoints) bypassed static rules.",
      "executed_at": "2026-08-17T12:43:15.526967+00:00"
    }
  ]
}